{
  "schemaVersion": 1,
  "runId": "m2-d-example",
  "sessionId": "m2-d-example-session",
  "clockDomain": "ANDROID_MONOTONIC",
  "events": [
    {
      "sequence": 1,
      "elapsedRealtimeNs": 1000000,
      "recoveryChainId": "recovery-1",
      "failureId": null,
      "fetchKey": "fixture:F1/audio-main/f1-audio-1/segment-1-00001",
      "extentId": "m2d:f1:audio:1:1",
      "kind": "BINDING_SELECTED_FOR_ATTEMPT",
      "previousRevision": null,
      "currentRevision": "binding-1",
      "attemptCorrelationId": "fetch-1:attempt-1",
      "refreshCorrelationId": null,
      "outcome": null
    },
    {
      "sequence": 2,
      "elapsedRealtimeNs": 1012000,
      "recoveryChainId": "recovery-1",
      "failureId": null,
      "fetchKey": "fixture:F1/audio-main/f1-audio-1/segment-1-00001",
      "extentId": "m2d:f1:audio:1:1",
      "kind": "REFRESH_REQUESTED",
      "previousRevision": "binding-1",
      "currentRevision": "binding-1",
      "attemptCorrelationId": null,
      "refreshCorrelationId": null,
      "outcome": null
    },
    {
      "sequence": 3,
      "elapsedRealtimeNs": 1013000,
      "recoveryChainId": "recovery-1",
      "failureId": null,
      "fetchKey": "fixture:F1/audio-main/f1-audio-1/segment-1-00001",
      "extentId": "m2d:f1:audio:1:1",
      "kind": "REFRESH_STARTED",
      "previousRevision": "binding-1",
      "currentRevision": "binding-1",
      "attemptCorrelationId": null,
      "refreshCorrelationId": "refresh-1",
      "outcome": null
    },
    {
      "sequence": 4,
      "elapsedRealtimeNs": 1030000,
      "recoveryChainId": "recovery-1",
      "failureId": null,
      "fetchKey": "fixture:F1/audio-main/f1-audio-1/segment-1-00001",
      "extentId": "m2d:f1:audio:1:1",
      "kind": "REFRESH_SUCCEEDED",
      "previousRevision": "binding-1",
      "currentRevision": "binding-2",
      "attemptCorrelationId": null,
      "refreshCorrelationId": "refresh-1",
      "outcome": "SUCCEEDED"
    },
    {
      "sequence": 5,
      "elapsedRealtimeNs": 1035000,
      "recoveryChainId": "recovery-1",
      "failureId": "recovery-1:failure-1",
      "fetchKey": "fixture:F1/audio-main/f1-audio-1/segment-1-00001",
      "extentId": "m2d:f1:audio:1:1",
      "kind": "BINDING_SELECTED_FOR_ATTEMPT",
      "previousRevision": null,
      "currentRevision": "binding-2",
      "attemptCorrelationId": "fetch-2:attempt-1",
      "refreshCorrelationId": null,
      "outcome": null
    },
    {
      "sequence": 6,
      "elapsedRealtimeNs": 1047000,
      "recoveryChainId": "recovery-2",
      "failureId": null,
      "fetchKey": "fixture:F1/audio-main/f1-audio-1/segment-1-00002",
      "extentId": "m2d:f1:audio:1:2",
      "kind": "BINDING_SELECTED_FOR_ATTEMPT",
      "previousRevision": null,
      "currentRevision": "binding-2",
      "attemptCorrelationId": "fetch-3:attempt-1",
      "refreshCorrelationId": null,
      "outcome": null
    },
    {
      "sequence": 7,
      "elapsedRealtimeNs": 1051000,
      "recoveryChainId": "recovery-2",
      "failureId": "recovery-2:failure-1",
      "fetchKey": "fixture:F1/audio-main/f1-audio-1/segment-1-00002",
      "extentId": "m2d:f1:audio:1:2",
      "kind": "BINDING_SELECTED_FOR_ATTEMPT",
      "previousRevision": null,
      "currentRevision": "binding-2",
      "attemptCorrelationId": "fetch-4:attempt-1",
      "refreshCorrelationId": null,
      "outcome": null
    }
  ]
}
